<?xml version="1.0" encoding="UTF-8"?>
<!DOCTYPE PurchaseOrderMessage SYSTEM "http://usertest.sciquest.com/app_docs/dtd/po/PO_3_0.dtd">
<PurchaseOrderMessage version="3.0">
	<Header>
		<MessageId>
			2afc95fb-6170-4c90-b862-0162cf5a6435
		</MessageId>
		<Timestamp>
			2018-04-16T12:47:10.389-04:00
		</Timestamp>
	</Header>
	<ResponseMessage>
		<Status>
			<StatusCode>
				200
			</StatusCode>
			<StatusText>
				Success
			</StatusText>
		</Status>

	</ResponseMessage>
</PurchaseOrderMessage>
